{
  "schema_version": "1.0.0",
  "generated_at": "2026-03-30T15:11:30.290758+00:00",
  "lesson_id": "8차시",
  "sheet_name": "8차시",
  "lesson_title": "국가기관이 하는 일 — [주제 도입] 열려라 이야기 / 외쳐라 빙고",
  "lesson_type": "core",
  "pdf_pages": [
    13,
    14,
    15,
    16,
    17,
    18,
    19,
    20,
    21,
    22,
    23,
    24,
    25,
    26,
    27,
    28,
    29,
    30,
    31,
    32,
    33,
    34,
    35,
    36,
    37,
    38,
    39,
    40,
    41,
    42,
    43,
    44,
    45,
    46,
    47,
    48,
    49,
    50,
    51,
    52,
    53,
    54,
    55,
    56,
    57,
    58,
    59,
    60,
    61,
    62,
    63,
    64,
    65,
    66,
    67,
    68,
    69,
    70,
    71,
    72,
    73
  ],
  "essential_question": "국가기관이 하는 일 — [주제 도입] 열려라 이야기 / 외쳐라 빙고",
  "learning_goals": [
    "국가기관이 하는 일 — [주제 도입] 열려라 이야기의 핵심 내용을 설명할 수 있다."
  ],
  "key_concepts": [
    "국가기관",
    "하는",
    "도입",
    "열려라",
    "이야기"
  ],
  "vocabulary": [
    "국가기관",
    "하는",
    "도입"
  ],
  "misconceptions": [
    "선거를 단순히 사람을 뽑는 행사로만 이해할 수 있다.",
    "민주주의의 핵심이 참여보다 결과에만 있다고 오해할 수 있다."
  ],
  "difficulty_band": "on-level",
  "content_chunks": [
    {
      "chunk_id": "8차시-chunk-1",
      "label": "학습 덩어리 1",
      "content_type": "mixed",
      "knowledge_type": "procedure",
      "summary": "1 낱말 구름을 보고, 이 주제에서 배울 내용이 무엇인지 생각해 봅시다.",
      "source_pages": [
        13,
        14,
        15,
        16,
        17,
        18,
        19,
        20,
        21,
        22,
        23,
        24,
        25,
        26,
        27,
        28,
        29,
        30,
        31,
        32,
        33,
        34,
        35,
        36,
        37,
        38,
        39,
        40,
        41,
        42
      ],
      "suggested_activity_types": [
        "see_think_wonder",
        "learning_note",
        "worksheet"
      ]
    },
    {
      "chunk_id": "8차시-chunk-2",
      "label": "학습 덩어리 2",
      "content_type": "mixed",
      "knowledge_type": "procedure",
      "summary": "자동차를 소유한 가정이 늘어나고, 컴퓨터 보급률도 높아졌다.",
      "source_pages": [
        43,
        44,
        45,
        46,
        47,
        48,
        49,
        50,
        51,
        52,
        53,
        54,
        55,
        56,
        57,
        58,
        59,
        60,
        61,
        62,
        63,
        64,
        65,
        66,
        67,
        68,
        69,
        70,
        71,
        72,
        73
      ],
      "suggested_activity_types": [
        "learning_note",
        "worksheet"
      ]
    }
  ],
  "source_page_refs": [
    13,
    14,
    15,
    16,
    17,
    18,
    19,
    20,
    21,
    22,
    23,
    24,
    25,
    26,
    27,
    28,
    29,
    30,
    31,
    32,
    33,
    34,
    35,
    36,
    37,
    38,
    39,
    40,
    41,
    42,
    43,
    44,
    45,
    46,
    47,
    48,
    49,
    50,
    51,
    52,
    53,
    54,
    55,
    56,
    57,
    58,
    59,
    60,
    61,
    62,
    63,
    64,
    65,
    66,
    67,
    68,
    69,
    70,
    71,
    72,
    73
  ],
  "analysis_confidence": 0.75,
  "review_status": "draft",
  "notes": "자동 생성 초안. lesson title, key concepts, chunks를 검토 후 승인 필요."
}
