{
  "schema_version": "1.0.0",
  "generated_at": "2026-03-31T09:00:00Z",
  "lesson_id": "8-9차시",
  "sheet_name": "8-9차시",
  "lesson_title": "민주화와 산업화로 달라진 생활 문화 — 4·19 혁명 이해하기",
  "lesson_type": "intro",
  "pdf_pages": [
    29
  ],
  "essential_question": "민주화와 산업화라는 핵심 키워드를 통해 우리가 앞으로 배울 우리나라 현대사의 주요 모습은 무엇일까요?",
  "learning_goals": [
    "민주화와 산업화와 관련된 핵심 용어를 찾아보고, 이번 주제에서 학습할 내용을 예측할 수 있다.",
    "낱말 구름 활동을 통해 4·19 혁명, 5·18 민주화 운동 등 주요 역사적 사건의 명칭을 익힐 수 있다."
  ],
  "key_concepts": [
    "민주화",
    "산업화",
    "4·19 혁명",
    "5·18 민주화 운동",
    "6월 민주 항쟁",
    "경제성장",
    "시민 의식"
  ],
  "vocabulary": [
    "독재",
    "직선제",
    "지방 자치제",
    "중화학 공업",
    "경공업",
    "생태환경"
  ],
  "misconceptions": [
    "민주화 운동과 경제 성장이 서로 시기적으로나 내용적으로 전혀 무관한 별개의 사건들이라고 오해할 수 있음."
  ],
  "difficulty_band": "on-level",
  "content_chunks": [
    {
      "chunk_id": "8-9차시-chunk-1",
      "label": "낱말 구름을 통한 주제 도입",
      "content_type": "activity",
      "knowledge_type": "concept",
      "summary": "민주화, 산업화, 4·19 혁명 등 현대사의 주요 키워드가 포함된 낱말 구름을 탐색하며 주제에 대한 흥미를 유발하고 배울 내용을 생각해보는 단계임.",
      "source_pages": [
        29
      ],
      "suggested_activity_types": [
        "word-cloud-analysis",
        "bingo-game"
      ]
    }
  ],
  "source_page_refs": [
    29
  ],
  "analysis_confidence": 0.9,
  "review_status": "draft",
  "notes": "29쪽은 단원 도입 및 용어 탐색 페이지로, 낱말 구름과 빙고 놀이를 통해 4·19 혁명을 포함한 현대사의 주요 흐름을 조망하는 구성임."
}
