{
  "schema_version": "1.0.0",
  "generated_at": "2026-03-30T15:32:23.316634+00:00",
  "lesson_id": "11차시",
  "sheet_name": "11차시",
  "lesson_title": "우리나라는 어떻게 산업화를 이루었을까요?",
  "lesson_type": "core",
  "pdf_pages": [
    41
  ],
  "essential_question": "우리나라는 어떻게 산업화를 이루었을까요?",
  "learning_goals": [
    "우리나라는 어떻게 산업화를 이루었을까요의 핵심 내용을 설명할 수 있다."
  ],
  "key_concepts": [
    "우리나라",
    "어떻게",
    "산업화",
    "이루었을까요",
    "년대"
  ],
  "vocabulary": [
    "우리나라",
    "어떻게",
    "산업화"
  ],
  "misconceptions": [],
  "difficulty_band": "on-level",
  "content_chunks": [
    {
      "chunk_id": "11차시-chunk-1",
      "label": "학습 덩어리 1",
      "content_type": "mixed",
      "knowledge_type": "procedure",
      "summary": "2000년대 이후 우리나라는 1996년 경제협력개발기구 (OECD)에 가입하는 등 1990년대에도 경제가 꾸준히 성장했다.",
      "source_pages": [
        41
      ],
      "suggested_activity_types": [
        "see_think_wonder",
        "learning_note",
        "worksheet"
      ]
    }
  ],
  "source_page_refs": [
    41
  ],
  "analysis_confidence": 0.75,
  "review_status": "draft",
  "notes": "자동 생성 초안. lesson title, key concepts, chunks를 검토 후 승인 필요."
}
