{
  "schema_version": "1.0.0",
  "generated_at": "2026-03-30T14:57:35.154101+00:00",
  "lesson_id": "9-10차시",
  "sheet_name": "9-10차시",
  "lesson_title": "국가기관이 하는 일 — 국회의 구성과 하는 일 파악하기",
  "lesson_type": "core",
  "pdf_pages": [
    74
  ],
  "essential_question": "국가기관이 하는 일 — 국회의 구성과 하는 일 파악하기",
  "learning_goals": [
    "국가기관이 하는 일 — 국회의 구성과 하는 일 파악하기의 핵심 내용을 설명할 수 있다."
  ],
  "key_concepts": [
    "국가기관",
    "하는",
    "국회",
    "구성",
    "파악하기"
  ],
  "vocabulary": [
    "국가기관",
    "하는",
    "국회"
  ],
  "misconceptions": [
    "선거를 단순히 사람을 뽑는 행사로만 이해할 수 있다.",
    "민주주의의 핵심이 참여보다 결과에만 있다고 오해할 수 있다."
  ],
  "difficulty_band": "on-level",
  "content_chunks": [
    {
      "chunk_id": "9-10차시-chunk-1",
      "label": "학습 덩어리 1",
      "content_type": "mixed",
      "knowledge_type": "concept",
      "summary": "국회의 구성과 하는 일 국회는 국회의원들로 구성된 국민의 대표 기관이다.",
      "source_pages": [
        74
      ],
      "suggested_activity_types": [
        "see_think_wonder",
        "learning_note",
        "worksheet"
      ]
    }
  ],
  "source_page_refs": [
    74
  ],
  "analysis_confidence": 0.75,
  "review_status": "draft",
  "notes": "자동 생성 초안. lesson title, key concepts, chunks를 검토 후 승인 필요."
}
