{
  "schema_version": "1.0.0",
  "generated_at": "2026-03-31T00:00:00Z",
  "lesson_id": "10차시",
  "sheet_name": "10차시",
  "lesson_title": "민주화와 산업화로 달라진 생활 문화 — 대통령 직선제와 지방 자치제의 부활 이해하기",
  "lesson_type": "intro",
  "pdf_pages": [
    29
  ],
  "essential_question": "민주화와 산업화로 달라진 우리 사회를 나타내는 주요 낱말들은 무엇이며, 이를 통해 앞으로 배울 내용을 어떻게 예측할 수 있을까요?",
  "learning_goals": [
    "민주화와 산업화 관련 핵심 낱말을 탐색하고 단원에서 배울 주요 주제를 추론할 수 있다.",
    "핵심 낱말 빙고 놀이를 통해 학습 용어에 대한 친숙도를 높이고 학습 동기를 유발할 수 있다."
  ],
  "key_concepts": [
    "민주화",
    "산업화",
    "생활 문화",
    "지방 자치제",
    "직선제",
    "경제성장"
  ],
  "vocabulary": [
    "민주화",
    "산업화",
    "지방 자치제",
    "직선제",
    "시민 의식",
    "중화학 공업",
    "생태환경",
    "경제성장"
  ],
  "misconceptions": [
    "낱말 구름의 단어들이 서로 독립적인 사건이나 현상이라고만 생각할 수 있으나, 민주화와 산업화는 상호 연관되어 생활 문화를 변화시켰음을 인지해야 함."
  ],
  "difficulty_band": "on-level",
  "content_chunks": [
    {
      "chunk_id": "10차시-chunk-1",
      "label": "단원 도입 낱말 구름 탐색",
      "content_type": "text",
      "knowledge_type": "concept",
      "summary": "4.19 혁명, 5.18 민주화 운동, 6월 민주 항쟁, 직선제, 중화학 공업 등 대단원에서 다룰 핵심 용어들이 포함된 낱말 구름을 살펴보고 학습 내용을 예상해 봅니다.",
      "source_pages": [
        29
      ],
      "suggested_activity_types": [
        "브레인스토밍",
        "생각 그물 만들기"
      ]
    },
    {
      "chunk_id": "10차시-chunk-2",
      "label": "낱말 빙고 놀이",
      "content_type": "activity",
      "knowledge_type": "application",
      "summary": "낱말 구름 속의 단어 9개를 골라 빙고 판을 채우고 놀이를 진행하며 주요 역사적·사회적 용어에 익숙해지는 활동을 수행합니다.",
      "source_pages": [
        29
      ],
      "suggested_activity_types": [
        "게임 기반 학습",
        "용어 퀴즈"
      ]
    }
  ],
  "source_page_refs": [
    29
  ],
  "analysis_confidence": 0.95,
  "review_status": "draft",
  "notes": "이 차시는 대단원 '민주화와 산업화로 달라진 생활 문화'의 도입부로, 텍스트 분석 결과 낱말 구름과 빙고 놀이를 통해 주요 개념을 훑어보는 구성입니다. 제공된 차시명(대통령 직선제와 지방 자치제)은 이 단원에서 다룰 핵심 주제 중 하나로 연결됩니다."
}
