{
  "schema_version": "1.0.0",
  "generated_at": "2026-03-31T00:00:00Z",
  "lesson_id": "10차시",
  "sheet_name": "10차시",
  "lesson_title": "민주화와 산업화로 달라진 생활 문화 — 대통령 직선제와 지방 자치제의 부활 이해하기",
  "lesson_type": "core",
  "pdf_pages": [
    29
  ],
  "essential_question": "우리나라의 민주주의 발전을 이끈 대통령 직선제와 지방 자치제의 부활은 어떤 의미를 갖는가?",
  "learning_goals": [
    "대통령 직선제와 지방 자치제 부활의 의미를 설명할 수 있다.",
    "민주화 과정에서 나타난 주요 사건들과 용어의 관계를 파악할 수 있다."
  ],
  "key_concepts": [
    "민주화",
    "대통령 직선제",
    "지방 자치제",
    "시민 의식",
    "6월 민주 항쟁"
  ],
  "vocabulary": [
    "직선제",
    "지방 자치제",
    "독재",
    "시민 의식",
    "민주화 운동"
  ],
  "misconceptions": [
    "지방 자치제가 현대에 처음 생긴 제도라고 오해할 수 있으나, '부활'이라는 표현을 통해 이전의 역사를 인지해야 함."
  ],
  "difficulty_band": "on-level",
  "content_chunks": [
    {
      "chunk_id": "10차시-chunk-1",
      "label": "민주화와 산업화 핵심 키워드 탐색",
      "content_type": "mixed",
      "knowledge_type": "concept",
      "summary": "민주화와 산업화 관련 낱말 구름(4·19 혁명, 5·18 민주화 운동, 6월 민주 항쟁, 직선제, 지방 자치제 등)을 통해 주제의 핵심 내용을 예측하고 파악함.",
      "source_pages": [
        29
      ],
      "suggested_activity_types": [
        "see_think_wonder",
        "learning_note"
      ]
    },
    {
      "chunk_id": "10차시-chunk-2",
      "label": "민주화의 주요 제도 이해",
      "content_type": "text",
      "knowledge_type": "procedure",
      "summary": "대통령 직선제와 지방 자치제의 부활 등 민주주의가 실질적으로 생활 속에 자리 잡게 된 제도적 변화를 학습함.",
      "source_pages": [
        29
      ],
      "suggested_activity_types": [
        "worksheet",
        "learning_note"
      ]
    }
  ],
  "source_page_refs": [
    29
  ],
  "analysis_confidence": 0.9,
  "review_status": "draft",
  "notes": "추출된 텍스트의 낱말 구름 데이터를 바탕으로 대통령 직선제와 지방 자치제 부활을 핵심 내용으로 구성함. 도입부 성격의 낱말 놀이와 핵심 개념 학습이 병행되는 차시임."
}
