{
  "schema_version": "1.0.0",
  "generated_at": "2026-03-30T15:13:23.811714+00:00",
  "lesson_id": "4차시",
  "sheet_name": "4차시",
  "lesson_title": "지구본과 지도로 보는 세계 — 디지털 공간 영상 정보의 의미 알아보기",
  "lesson_type": "core",
  "pdf_pages": [
    116
  ],
  "essential_question": "지구본과 지도로 보는 세계 — 디지털 공간 영상 정보의 의미 알아보기",
  "learning_goals": [
    "지구본과 지도로 보는 세계 — 디지털 공간 영상 정보의 의미 알아보기의 핵심 내용을 설명할 수 있다."
  ],
  "key_concepts": [
    "지구본",
    "지도",
    "보는",
    "세계",
    "디지털"
  ],
  "vocabulary": [
    "지구본",
    "지도",
    "보는"
  ],
  "misconceptions": [],
  "difficulty_band": "on-level",
  "content_chunks": [
    {
      "chunk_id": "4차시-chunk-1",
      "label": "학습 덩어리 1",
      "content_type": "mixed",
      "knowledge_type": "concept",
      "summary": "아시아 대한 민국 대한 민국 아시아 태 평 양 동해 황해 남해 3D 레이어 역사적인 이미지 지구의 과거 모습을 담은 이미지를 확인해 보세요.",
      "source_pages": [
        116
      ],
      "suggested_activity_types": [
        "see_think_wonder",
        "learning_note",
        "worksheet"
      ]
    }
  ],
  "source_page_refs": [
    116
  ],
  "analysis_confidence": 0.75,
  "review_status": "draft",
  "notes": "자동 생성 초안. lesson title, key concepts, chunks를 검토 후 승인 필요."
}
