{
  "schema_version": "1.0.0",
  "generated_at": "2026-03-26T13:28:05.670291+00:00",
  "lesson_id": "1차시",
  "sheet_name": "1차시",
  "lesson_title": "배울 내용 살펴보기",
  "lesson_type": "core",
  "pdf_pages": [
    1,
    2,
    3,
    4
  ],
  "essential_question": "배울 내용 살펴보기",
  "learning_goals": [
    "배울 내용 살펴보기의 핵심 내용을 설명할 수 있다."
  ],
  "key_concepts": [
    "배울",
    "살펴보기",
    "인물",
    "자신",
    "가치"
  ],
  "vocabulary": [
    "배울",
    "살펴보기",
    "인물"
  ],
  "misconceptions": [],
  "difficulty_band": "on-level",
  "content_chunks": [
    {
      "chunk_id": "1차시-chunk-1",
      "label": "학습 덩어리 1",
      "content_type": "mixed",
      "knowledge_type": "concept",
      "summary": "자신의 삶과 관련지어 읽어요 인물이 추구하는 가치를 이해하고 자신의 삶 되돌아보기1 인물이 추구하는 가치 파악하기 인물이 추구하는 가치를 자신과 관련지으며 독서 감상문 쓰기 1 2 문화 향유 역량 34 장영실은 사람들의 삶을 소중히 여겨서 해시계, 물",
      "source_pages": [
        1,
        2
      ],
      "suggested_activity_types": [
        "see_think_wonder",
        "learning_note",
        "worksheet"
      ]
    },
    {
      "chunk_id": "1차시-chunk-2",
      "label": "학습 덩어리 2",
      "content_type": "mixed",
      "knowledge_type": "concept",
      "summary": "작품 속 인물에 대해 경주가 쓴 독서 감상문을 읽고 물음에 답해 봅시다.",
      "source_pages": [
        3,
        4
      ],
      "suggested_activity_types": [
        "learning_note",
        "worksheet"
      ]
    }
  ],
  "source_page_refs": [
    1,
    2,
    3,
    4
  ],
  "analysis_confidence": 0.75,
  "review_status": "draft",
  "notes": "자동 생성 초안. lesson title, key concepts, chunks를 검토 후 승인 필요."
}
