{
  "schema_version": "1.0.0",
  "generated_at": "2026-03-30T15:20:39.547960+00:00",
  "lesson_id": "17-18차시",
  "sheet_name": "17-18차시",
  "lesson_title": "민주주의와 미디어 — 미디어를 올바르게 이용하는 방법 알아보기",
  "lesson_type": "core",
  "pdf_pages": [
    7,
    8,
    9,
    10,
    11,
    12,
    13,
    14,
    15,
    16,
    17,
    18,
    19,
    20,
    21,
    22,
    23,
    24,
    25,
    26,
    27,
    28,
    29,
    30,
    31,
    32,
    33,
    34,
    35,
    36,
    37,
    38,
    39,
    40,
    41,
    42,
    43,
    44,
    45,
    46,
    47,
    48
  ],
  "essential_question": "민주주의와 미디어 — 미디어를 올바르게 이용하는 방법 알아보기",
  "learning_goals": [
    "민주주의와 미디어 — 미디어를 올바르게 이용하는 방법 알아보기의 핵심 내용을 설명할 수 있다."
  ],
  "key_concepts": [
    "미디어",
    "올바르게",
    "이용하",
    "방법",
    "알아보기"
  ],
  "vocabulary": [
    "미디어",
    "올바르게",
    "이용하"
  ],
  "misconceptions": [
    "선거를 단순히 사람을 뽑는 행사로만 이해할 수 있다.",
    "민주주의의 핵심이 참여보다 결과에만 있다고 오해할 수 있다."
  ],
  "difficulty_band": "on-level",
  "content_chunks": [
    {
      "chunk_id": "17-18차시-chunk-1",
      "label": "학습 덩어리 1",
      "content_type": "mixed",
      "knowledge_type": "procedure",
      "summary": "다음 내용이 옳으면 ◯표를, 틀리면 ×표를 선택해 오늘의 점심 식단을 찾아봅시다.",
      "source_pages": [
        7,
        8,
        9,
        10,
        11,
        12,
        13,
        14,
        15,
        16,
        17,
        18,
        19,
        20,
        21,
        22,
        23,
        24,
        25,
        26,
        27
      ],
      "suggested_activity_types": [
        "see_think_wonder",
        "learning_note",
        "worksheet"
      ]
    },
    {
      "chunk_id": "17-18차시-chunk-2",
      "label": "학습 덩어리 2",
      "content_type": "mixed",
      "knowledge_type": "procedure",
      "summary": "2 민주화와 산업화로 달라진 생활 문화 민주화를 이루려는 다양한 분야 사람들의 노력을 설명할 수 있어요.",
      "source_pages": [
        28,
        29,
        30,
        31,
        32,
        33,
        34,
        35,
        36,
        37,
        38,
        39,
        40,
        41,
        42,
        43,
        44,
        45,
        46,
        47,
        48
      ],
      "suggested_activity_types": [
        "learning_note",
        "worksheet"
      ]
    }
  ],
  "source_page_refs": [
    7,
    8,
    9,
    10,
    11,
    12,
    13,
    14,
    15,
    16,
    17,
    18,
    19,
    20,
    21,
    22,
    23,
    24,
    25,
    26,
    27,
    28,
    29,
    30,
    31,
    32,
    33,
    34,
    35,
    36,
    37,
    38,
    39,
    40,
    41,
    42,
    43,
    44,
    45,
    46,
    47,
    48
  ],
  "analysis_confidence": 0.75,
  "review_status": "draft",
  "notes": "자동 생성 초안. lesson title, key concepts, chunks를 검토 후 승인 필요."
}
