{
  "schema_version": "1.0.0",
  "generated_at": "2026-03-30T15:13:08.076833+00:00",
  "lesson_id": "6-7차시",
  "sheet_name": "6-7차시",
  "lesson_title": "민주주의와 선거 — 선거에 적극적으로 참여해야 하는 까닭 알아보기",
  "lesson_type": "core",
  "pdf_pages": [
    32
  ],
  "essential_question": "민주주의와 선거 — 선거에 적극적으로 참여해야 하는 까닭 알아보기",
  "learning_goals": [
    "민주주의와 선거 — 선거에 적극적으로 참여해야 하는 까닭 알아보기의 핵심 내용을 설명할 수 있다."
  ],
  "key_concepts": [
    "선거",
    "선거에",
    "적극적",
    "참여해야",
    "하는"
  ],
  "vocabulary": [
    "선거",
    "선거에",
    "적극적"
  ],
  "misconceptions": [
    "선거를 단순히 사람을 뽑는 행사로만 이해할 수 있다.",
    "민주주의의 핵심이 참여보다 결과에만 있다고 오해할 수 있다."
  ],
  "difficulty_band": "on-level",
  "content_chunks": [
    {
      "chunk_id": "6-7차시-chunk-1",
      "label": "학습 덩어리 1",
      "content_type": "mixed",
      "knowledge_type": "concept",
      "summary": "4·19 혁명 이승만 정부는 권력을 이어 나가려고 부정한 방법으로 선거에서 승리 했다(3·15 부정 선거).",
      "source_pages": [
        32
      ],
      "suggested_activity_types": [
        "see_think_wonder",
        "learning_note",
        "worksheet"
      ]
    }
  ],
  "source_page_refs": [
    32
  ],
  "analysis_confidence": 0.75,
  "review_status": "draft",
  "notes": "자동 생성 초안. lesson title, key concepts, chunks를 검토 후 승인 필요."
}
