{
  "schema_version": "1.0.0",
  "generated_at": "2026-03-30T15:13:33.519222+00:00",
  "lesson_id": "15차시",
  "sheet_name": "15차시",
  "lesson_title": "3단원 정리 — [단원 마무리] 나만의 누리집 완성하기 / 창의·융 합 사고력 쑥쑥",
  "lesson_type": "core",
  "pdf_pages": [
    49
  ],
  "essential_question": "3단원 정리 — [단원 마무리] 나만의 누리집 완성하기 / 창의·융 합 사고력 쑥쑥",
  "learning_goals": [
    "3단원 정리 — [단원 마무리] 나만의 누리집 완성하기의 핵심 내용을 설명할 수 있다."
  ],
  "key_concepts": [
    "마무리",
    "나만",
    "누리집",
    "완성하기",
    "창의"
  ],
  "vocabulary": [
    "마무리",
    "나만",
    "누리집"
  ],
  "misconceptions": [
    "선거를 단순히 사람을 뽑는 행사로만 이해할 수 있다."
  ],
  "difficulty_band": "on-level",
  "content_chunks": [
    {
      "chunk_id": "15차시-chunk-1",
      "label": "학습 덩어리 1",
      "content_type": "mixed",
      "knowledge_type": "procedure",
      "summary": "산업화 카드 뉴스로 보는 인기 영상 이 단원의 독재 정권에 맞서 민주화 운동이 일어나다.",
      "source_pages": [
        49
      ],
      "suggested_activity_types": [
        "see_think_wonder",
        "learning_note",
        "worksheet"
      ]
    }
  ],
  "source_page_refs": [
    49
  ],
  "analysis_confidence": 0.75,
  "review_status": "draft",
  "notes": "자동 생성 초안. lesson title, key concepts, chunks를 검토 후 승인 필요."
}
