{
  "schema_version": "1.0.0",
  "generated_at": "2026-03-30T14:57:27.954181+00:00",
  "lesson_id": "12-13차시",
  "sheet_name": "12-13차시",
  "lesson_title": "민주화와 산업화로 달라진 생활 문화 — 산업화로 달라진 사회와 생활 문화 이해하기",
  "lesson_type": "core",
  "pdf_pages": [
    10,
    11,
    12,
    13,
    14,
    15,
    16,
    17,
    18,
    19,
    20,
    21,
    22,
    23,
    24,
    25,
    26,
    27,
    28,
    29,
    30,
    31,
    32,
    33,
    34,
    35,
    36,
    37,
    38,
    39,
    40,
    41,
    42,
    43,
    44,
    45,
    46,
    47,
    48
  ],
  "essential_question": "민주화와 산업화로 달라진 생활 문화 — 산업화로 달라진 사회와 생활 문화 이해하기",
  "learning_goals": [
    "민주화와 산업화로 달라진 생활 문화 — 산업화로 달라진 사회와 생활 문화 이해하기의 핵심 내용을 설명할 수 있다."
  ],
  "key_concepts": [
    "민주화",
    "산업화",
    "달라진",
    "생활",
    "문화"
  ],
  "vocabulary": [
    "민주화",
    "산업화",
    "달라진"
  ],
  "misconceptions": [
    "선거를 단순히 사람을 뽑는 행사로만 이해할 수 있다.",
    "민주주의의 핵심이 참여보다 결과에만 있다고 오해할 수 있다."
  ],
  "difficulty_band": "on-level",
  "content_chunks": [
    {
      "chunk_id": "12-13차시-chunk-1",
      "label": "학습 덩어리 1",
      "content_type": "mixed",
      "knowledge_type": "procedure",
      "summary": "1 평화 통일을 위한 노력 1 민주화와 산업화로 달라진 생활 문화 2 분 단 평화 통 일 민 주화 산업 화 평화 통일을 위한 노력, 민주화와 산업화 애니메이션 사람들의 이야기를 듣고, 나와 함께 이 단원을 공부할 내 친구 하나를 찾아 줘.",
      "source_pages": [
        10,
        11,
        12,
        13,
        14,
        15,
        16,
        17,
        18,
        19,
        20,
        21,
        22,
        23,
        24,
        25,
        26,
        27,
        28
      ],
      "suggested_activity_types": [
        "see_think_wonder",
        "learning_note",
        "worksheet"
      ]
    },
    {
      "chunk_id": "12-13차시-chunk-2",
      "label": "학습 덩어리 2",
      "content_type": "mixed",
      "knowledge_type": "procedure",
      "summary": "민주화 산업화 생활 문화 4.19 혁명 5.18 민주화 운동 6월 민주 항쟁 지방 자치제 시민 의식 중화학 공업 생태환경 경제성장 시민운동 직선제 독재 경공업 1 낱말 구름을 보고, 이 주제에서 배울 내용이 무엇인지 생각해 봅시다.",
      "source_pages": [
        29,
        30,
        31,
        32,
        33,
        34,
        35,
        36,
        37,
        38,
        39,
        40,
        41,
        42,
        43,
        44,
        45,
        46,
        47,
        48
      ],
      "suggested_activity_types": [
        "learning_note",
        "worksheet"
      ]
    }
  ],
  "source_page_refs": [
    10,
    11,
    12,
    13,
    14,
    15,
    16,
    17,
    18,
    19,
    20,
    21,
    22,
    23,
    24,
    25,
    26,
    27,
    28,
    29,
    30,
    31,
    32,
    33,
    34,
    35,
    36,
    37,
    38,
    39,
    40,
    41,
    42,
    43,
    44,
    45,
    46,
    47,
    48
  ],
  "analysis_confidence": 0.75,
  "review_status": "draft",
  "notes": "자동 생성 초안. lesson title, key concepts, chunks를 검토 후 승인 필요. Gemini fallback used: Gemini CLI timed out after 120 seconds for lesson_analysis_ai"
}
