{
  "schema_version": "1.0.0",
  "generated_at": "2026-03-31T00:45:00.000000+00:00",
  "lesson_id": "11차시",
  "sheet_name": "11차시",
  "lesson_title": "우리나라는 어떻게 산업화를 이루었을까요?",
  "lesson_type": "core",
  "pdf_pages": [
    41
  ],
  "essential_question": "우리나라는 시기별로 어떤 산업을 중심으로 경제 성장을 이루었으며, 위기를 어떻게 극복했을까요?",
  "learning_goals": [
    "1970년대부터 2000년대 이후까지 우리나라의 시기별 주요 산업 변화 과정을 설명할 수 있다.",
    "1990년대말 외환 위기의 원인과 이를 극복하기 위한 노력을 이해한다."
  ],
  "key_concepts": [
    "중화학 공업",
    "수출",
    "외환 위기",
    "첨단 산업",
    "서비스 산업"
  ],
  "vocabulary": [
    "OECD(경제협력개발기구)",
    "IMF(국제통화기금)",
    "반도체",
    "인공지능(AI)",
    "구제 금융"
  ],
  "misconceptions": [
    "산업화가 특정 시기에만 집중적으로 일어났다고 생각할 수 있으나, 1970년대부터 현재까지 지속적으로 고도화되며 진행되고 있음을 이해해야 함."
  ],
  "difficulty_band": "on-level",
  "content_chunks": [
    {
      "chunk_id": "11차시-chunk-1",
      "label": "시기별 산업화 과정",
      "content_type": "text",
      "knowledge_type": "fact",
      "summary": "1970년대 중화학 공업, 1980년대 자동차 및 전자 산업, 1990년대 반도체 중심의 산업 발전 과정을 다룸.",
      "source_pages": [
        41
      ]
    },
    {
      "chunk_id": "11차시-chunk-2",
      "label": "외환 위기와 극복",
      "content_type": "text",
      "knowledge_type": "cause-effect",
      "summary": "1997년 외환 부족으로 인한 경제 위기 발생과 IMF 구제 금융 요청, 국민적 극복 노력을 설명함.",
      "source_pages": [
        41
      ]
    },
    {
      "chunk_id": "11차시-chunk-3",
      "label": "2000년대 이후 첨단 및 서비스 산업",
      "content_type": "text",
      "knowledge_type": "concept",
      "summary": "우주 항공, 생명 공학, AI 등 첨단 산업과 삶의 질을 높이는 서비스 관련 산업의 성장을 다룸.",
      "source_pages": [
        41
      ]
    }
  ],
  "source_page_refs": [
    41
  ],
  "analysis_confidence": 0.95,
  "review_status": "draft",
  "notes": "텍스트북 컨텍스트를 바탕으로 시기별 산업 특징과 외환 위기 내용을 보강함. 페이지 41의 핵심 내용을 모두 포함함."
}
