{
  "schema_version": "1.0.0",
  "generated_at": "2026-03-30T15:05:38.973502+00:00",
  "lesson_id": "3차시",
  "sheet_name": "3차시",
  "lesson_title": "민주주의와 선거 — 민주주의에서 선거의 역할 파악하기",
  "lesson_type": "core",
  "pdf_pages": [
    54
  ],
  "essential_question": "민주주의와 선거 — 민주주의에서 선거의 역할 파악하기",
  "learning_goals": [
    "민주주의와 선거 — 민주주의에서 선거의 역할 파악하기의 핵심 내용을 설명할 수 있다."
  ],
  "key_concepts": [
    "선거",
    "역할",
    "파악하기",
    "파악할",
    "사람들"
  ],
  "vocabulary": [
    "선거",
    "역할",
    "파악하기"
  ],
  "misconceptions": [
    "선거를 단순히 사람을 뽑는 행사로만 이해할 수 있다.",
    "민주주의의 핵심이 참여보다 결과에만 있다고 오해할 수 있다."
  ],
  "difficulty_band": "on-level",
  "content_chunks": [
    {
      "chunk_id": "3차시-chunk-1",
      "label": "학습 덩어리 1",
      "content_type": "mixed",
      "knowledge_type": "procedure",
      "summary": "사람들이 몸으로 만든 저 모양은 무엇을 의미하는 걸까?",
      "source_pages": [
        54
      ],
      "suggested_activity_types": [
        "see_think_wonder",
        "learning_note",
        "worksheet"
      ]
    }
  ],
  "source_page_refs": [
    54
  ],
  "analysis_confidence": 0.75,
  "review_status": "draft",
  "notes": "자동 생성 초안. lesson title, key concepts, chunks를 검토 후 승인 필요."
}
