{
  "schema_version": "1.0.0",
  "generated_at": "2026-03-31T01:00:26.502723+00:00",
  "lesson_id": "12차시",
  "sheet_name": "12차시",
  "lesson_title": "법원의 구성과 하는 일을 알아볼까요?",
  "lesson_type": "core",
  "pdf_pages": [
    72
  ],
  "essential_question": "법원의 구성과 하는 일을 알아볼까요?",
  "learning_goals": [
    "법원의 구성과 하는 일을 알아볼까요의 핵심 내용을 설명할 수 있다."
  ],
  "key_concepts": [
    "법원",
    "구성",
    "하는",
    "일을",
    "알아볼까요"
  ],
  "vocabulary": [
    "법원",
    "구성",
    "하는"
  ],
  "misconceptions": [
    "민주주의의 핵심이 참여보다 결과에만 있다고 오해할 수 있다."
  ],
  "difficulty_band": "on-level",
  "content_chunks": [
    {
      "chunk_id": "12차시-chunk-1",
      "label": "학습 덩어리 1",
      "content_type": "mixed",
      "knowledge_type": "concept",
      "summary": "우리나라는 민주 국가로서 국민의 자유와 평등을 보장하고 인간의 존엄성 을 실현할 수 있도록 나라를 운영한다.",
      "source_pages": [
        72
      ],
      "suggested_activity_types": [
        "see_think_wonder",
        "learning_note",
        "worksheet"
      ]
    }
  ],
  "source_page_refs": [
    72
  ],
  "analysis_confidence": 0.75,
  "review_status": "draft",
  "notes": "자동 생성 초안. lesson title, key concepts, chunks를 검토 후 승인 필요."
}
