{
  "schema_version": "1.0.0",
  "generated_at": "2026-03-30T15:06:24.584483+00:00",
  "lesson_id": "10차시",
  "sheet_name": "10차시",
  "lesson_title": "민주화와 산업화로 달라진 생활 문화 — 대통령 직선제와 지방 자치제의 부활 이해하기",
  "lesson_type": "core",
  "pdf_pages": [
    29
  ],
  "essential_question": "민주화와 산업화로 달라진 생활 문화 — 대통령 직선제와 지방 자치제의 부활 이해하기",
  "learning_goals": [
    "민주화와 산업화로 달라진 생활 문화 — 대통령 직선제와 지방 자치제의 부활 이해하기의 핵심 내용을 설명할 수 있다."
  ],
  "key_concepts": [
    "민주화",
    "산업화",
    "달라진",
    "생활",
    "문화"
  ],
  "vocabulary": [
    "민주화",
    "산업화",
    "달라진"
  ],
  "misconceptions": [],
  "difficulty_band": "on-level",
  "content_chunks": [
    {
      "chunk_id": "10차시-chunk-1",
      "label": "학습 덩어리 1",
      "content_type": "mixed",
      "knowledge_type": "concept",
      "summary": "민주화 산업화 생활 문화 4.19 혁명 5.18 민주화 운동 6월 민주 항쟁 지방 자치제 시민 의식 중화학 공업 생태환경 경제성장 시민운동 직선제 독재 경공업 1 낱말 구름을 보고, 이 주제에서 배울 내용이 무엇인지 생각해 봅시다.",
      "source_pages": [
        29
      ],
      "suggested_activity_types": [
        "see_think_wonder",
        "learning_note",
        "worksheet"
      ]
    }
  ],
  "source_page_refs": [
    29
  ],
  "analysis_confidence": 0.75,
  "review_status": "draft",
  "notes": "자동 생성 초안. lesson title, key concepts, chunks를 검토 후 승인 필요. Gemini fallback used: Gemini CLI timed out after 120 seconds for lesson_analysis_ai"
}
